{
  "$schema": "../../../schema/skill-rules.schema.json",
  "id": "search",
  "title": "Procurar",
  "actionId": "search",
  "source": {
    "book": "Livro do Jogador 2024",
    "language": "pt-BR",
    "chapter": 1,
    "chapterTitle": "Glossário de Regras",
    "pdfPath": "doc/livro-jogador.pdf",
    "pdfPages": [
      373,
      373
    ]
  },
  "intro": "Com a ação Procurar, você realiza um teste de Sabedoria para perceber algo que não é evidente.",
  "bySkill": [
    {
      "skillId": "insight",
      "detects": "Estado mental de uma criatura"
    },
    {
      "skillId": "medicine",
      "detects": "Enfermidade de uma criatura ou causa da morte"
    },
    {
      "skillId": "perception",
      "detects": "Criatura ou objeto oculto"
    },
    {
      "skillId": "survival",
      "detects": "Comida ou rastros"
    }
  ]
}
