{
  "$schema": "../../../schema/skill-rules.schema.json",
  "id": "passive-perception",
  "title": "Percepção Passiva",
  "skillId": "perception",
  "source": {
    "book": "Livro do Jogador 2024",
    "language": "pt-BR",
    "chapter": 1,
    "chapterTitle": "Glossário de Regras",
    "pdfPath": "doc/livro-jogador.pdf",
    "pdfPages": [
      372,
      372
    ]
  },
  "formula": "10 + bônus do teste de Sabedoria (Percepção)",
  "advantageModifier": 5,
  "disadvantageModifier": -5,
  "workedExample": "Personagem nível 1, Sabedoria 15 (+2), proficiência em Percepção (+2): Percepção Passiva 14. Com Vantagem nos testes de Percepção, o valor sobe para 19."
}
